{
  "$schema": "../../../protocol/schemas/health-provenance.schema.json",
  "schemaVersion": 1,
  "status": "degraded",
  "mode": "shadow",
  "service": "dusk-sentinel",
  "profile": "sentinel",
  "runtime": {
    "language": "rust",
    "version": "0.1.0",
    "buildSha": null
  },
  "protocol": {
    "revision": "health-only-2026-10-30-9d6e5373",
    "lockStatus": "captured",
    "lockSha256": "5229f9228370359ec5369526a4ecdabcbf0b645c90f518cbfbe116c96509753e",
    "sourceWorktreeFingerprintSha256": "fd0c0b00026c1a19aa2c9cbcb346ddfba646ef717f455f4118bf8b1f5bed8585"
  },
  "dependencies": {
    "rpc": "unknown",
    "websocket": "unknown",
    "indexer": "unknown",
    "database": "unknown",
    "leaseStore": "unknown",
    "signer": "disabled"
  },
  "slots": {
    "rpc": null,
    "indexer": null,
    "lastReconciled": null,
    "lag": null
  },
  "work": {
    "pending": 0,
    "inFlight": 0,
    "awaitingReconciliation": 0,
    "oldestAttemptAgeSeconds": null
  },
  "circuitBreaker": {
    "state": "open",
    "reason": "captured_protocol_lock"
  },
  "parity": {
    "status": "unknown",
    "lastComparedAt": null,
    "mismatchCount": 0
  },
  "timestamps": {
    "startedAt": "2026-08-11T17:20:53Z",
    "lastScanAt": null,
    "lastSuccessAt": null,
    "generatedAt": "2026-08-11T17:20:53Z"
  }
}
